text,category
Adventure travel destinations for thrill-seekers looking for a challenge,Travel
The benefits of mindfulness meditation on stress reduction and focus,Health
Sustainable and cruelty-free beauty products gaining popularity,Fashion
Exclusive film screening at the downtown cinema this Friday,Event
International food festival featuring diverse cuisines in the city,Event
Essential exercises for maintaining a healthy spine and posture,Health
DIY fashion hacks to revamp your old wardrobe pieces,Fashion
Art and craft fair showcasing handmade creations by local artists,Travel
Yoga retreat in the serene mountains for a rejuvenating experience,Travel
Cultural festival celebrating diversity and traditions in the community,Event
Healthy smoothie recipes for a refreshing start to your day,Health
Eco-conscious travel tips for minimizing your environmental impact,Travel
Sneak peek into the latest tech innovations at the upcoming expo,Event
A guide to setting up a home meditation space for inner peace,Health
Sustainable fashion brands making a positive impact on the environment,Fashion
Jazz night featuring local musicians at the waterfront venue,Event
Weekend getaway ideas for a quick escape from the hustle and bustle,Travel
Tips for incorporating superfoods into your daily diet for better health,Health
DIY home decor ideas inspired by global design trends,Fashion
Local farmers market promoting fresh and organic produce,Event
Adventure travel destinations for thrill-seekers looking for a challenge,Travel
